Name,Context,Cleaned,Selective,Selective_Reduced,TF_Based
Backend Developer.docx,"Backend Developer - Python/Django



We are looking for Python/Django developers with 2-4 + years of experience to be part of our growing team. The role is of Python/Django Backend Web Developer who can handle the challenging work of Web applications development using Python / Django framework.

Required Skills:

Strong working knowledge of constructs of HTTP, RESTful APIs and WebSockets.

Build and maintain highly scalable Python processes for the purpose of data collection, manipulation, data pruning, trending and analytics, etc.

Strong understanding of Python and good knowledge of various Python Libraries (NumPy, Pandas, ORM libraries etc.), API's and toolkits

Able to integrate multiple data sources and databases into one system

Working knowledge of web templating engine for python such as Jinja2 etc

Ability to integrate user-facing elements developed by front-end developers with server-side logic.

Ability to integrate data storage solutions and caches.

Understanding of the threading limitations of Python, and multi-process architecture

Understanding of fundamental design principles behind a scalable application

Good understanding of event-driven programming in Python

Good knowledge of PostGRESQL

Able to create database schemas that represent and support business processes

Strong Analytical, Problem Solving & Innovative Skills.

Working knowledge of version control tools (GIT/SVN).

Experience/knowledge of working on the LINUX environment.

Attention to detail, problem-solver with strong analytical skill, good sense of urgency

Ability to carry out tasks without supervision and able to meet tight deadlines

Good Writing & Communication Skills. The candidate should be able to communicate with potential Clients and gather inputs/change requests.

Work with a performance oriented team driven by ownership and open to experiments

Strong interpersonal skills with excellent written and verbal communication

Responsibilities:

Develop back-end components to improve responsiveness and overall performance

Designing and implementing system architecture to handle scale

Coordinate with Frontend Dev team & Creating APIs (w/ DjangoRestFramework)

Integrating of web pages with Backend using templating engines for Python

Build bulletproof API integrations with third party APIs for various use cases

Good to have (Additional Skills):

Relevant full stack experience.

You've worked with core AWS services in the past and have experience with EC2, ELB, AutoScaling, CloudFront, S3

Demonstrable work/project portfolio online.

Working knowledge of front end technologies like Javascript, JQuery, HTML, and CSS

A good sense of design and aesthetics.

Experience/Zeal to work in a fast-paced startup environment.

Candidates who can join immediately will be preferredDevelop very high sense of ownership, the zeal to build scalable applications

Job Type: Full-time

Salary: 35,000.00 - 55,000.00 per month

Experience:

Django Development: 1 year (Preferred)

total work: 2 years (Preferred)

Education:

Bachelor's (Preferred)

Work Remotely:

Temporarily due to COVID-19",Backend developer PythonDjango look PythonDjango developer year experience part grow team role PythonDjango Backend web developer handle challenge work web application development use Python Django framework Required Skills strong work knowledge construct HTTP restful api WebSockets Build maintain highly scalable Python process purpose datum collection manipulation datum prune trend analytic strong understand Python good knowledge various Python Libraries NumPy Pandas ORM librarie api toolkit able integrate multiple datum source database system working knowledge web template engine python Jinja2 Ability integrate userface element develop frontend developer serverside logic ability integrate data storage solution cache understand threading limitation Python multiprocess architecture understand fundamental design principle scalable application good understand eventdriven program Python good knowledge postgresql able create database schema represent support business process Strong Analytical Problem Solving Innovative Skills Working knowledge version control tool GITSVN Experienceknowledge work LINUX environment attention detail problemsolver strong analytical skill good sense urgency ability carry task supervision able meet tight deadline Good write Communication Skills candidate able communicate potential client gather inputschange request work performance orient team drive ownership open experiment strong interpersonal skill excellent write verbal communication responsibility develop backend component improve responsiveness overall performance Designing implement system architecture handle scale Coordinate Frontend Dev team create api w DjangoRestFramework Integrating web page Backend use template engine Python Build bulletproof API integration third party api various use case Good Additional Skills relevant full stack experience work core AWS service experience EC2 ELB AutoScaling CloudFront S3 Demonstrable workproject portfolio online working knowledge front end technology Javascript JQuery HTML CSS good sense design aesthetic ExperienceZeal work fastpace startup environment candidate join immediately preferredDevelop high sense ownership zeal build scalable application Job Type Fulltime Salary month Experience Django Development year preferred total work year Preferred Education Bachelors Preferred work remotely temporarily due,Salary month postgresql WebSockets backend portfolio year web architecture request scale Build Job CSS S3 use Good knowledge Experience template understand Required aesthetic page develop front Working tight Bachelors look eventdriven source full api DjangoRestFramework work immediately preferred stack gather ORM python restful Innovative tool inputschange environment Pandas HTTP potential role AutoScaling database framework build datum sense prune Strong urgency schema end HTML problemsolver part technology Python deadline communication toolkit communicate handle fastpace represent workproject ExperienceZeal Javascript component challenge performance Django Type manipulation Communication verbal Coordinate Problem Dev core join ability limitation Solving Integrating integrate Libraries ownership due carry multiple bulletproof scalable open business implement API excellent version Development logic librarie userface party grow system improve Designing development skill service Preferred analytic element w detail trend experience principle online meet task client Backend able responsibility analytical fundamental NumPy candidate Education design interpersonal responsiveness good Jinja2 zeal serverside write working purpose control orient attention developer integration Frontend Analytical remotely case Demonstrable CloudFront overall create JQuery storage various total application LINUX EC2 frontend cache process supervision construct high maintain Ability threading highly experiment Skills program preferredDevelop Experienceknowledge Additional Fulltime GITSVN third team engine multiprocess data drive relevant solution PythonDjango ELB collection support temporarily AWS strong startup,Salary month postgresql WebSockets portfolio year web architecture request scale Build Job CSS S3 knowledge Experience template page source api DjangoRestFramework work stack ORM tool inputschange environment Pandas HTTP role AutoScaling database framework build datum sense prune urgency schema HTML part technology Python deadline communication toolkit communicate fastpace workproject ExperienceZeal Javascript component challenge performance Django Type manipulation Communication Coordinate Problem Dev core ability limitation Integrating ownership bulletproof business API version Development logic librarie userface party system Designing development skill service Preferred element detail trend experience principle meet task client Backend responsibility NumPy candidate Education design responsiveness Jinja2 zeal serverside purpose control orient attention developer integration Frontend Analytical case Demonstrable CloudFront JQuery storage application EC2 frontend cache process supervision Ability experiment Skills program preferredDevelop Experienceknowledge Additional Fulltime GITSVN team engine multiprocess solution PythonDjango ELB collection support startup,ability able additional aesthetic analytic analytical api application architecture attention autoscaling aws bachelors backend build bulletproof business cache candidate carry case challenge client cloudfront collection communicate communication component construct control coordinate core create css data database datum deadline demonstrable design designing detail dev develop developer development django djangorestframework drive due ec2 education elb element end engine environment eventdriven excellent experience experienceknowledge experiencezeal experiment fastpace framework front frontend full fulltime fundamental gather gitsvn good grow handle high highly html http immediately implement improve innovative inputschange integrate integrating integration interpersonal javascript jinja2 job join jquery knowledge librarie libraries limitation linux logic look maintain manipulation meet month multiple multiprocess numpy online open orient orm overall ownership page pandas part party performance portfolio postgresql potential preferred preferreddevelop principle problem problemsolver process program prune purpose python pythondjango relevant remotely represent request required responsibility responsiveness restful role s3 salary scalable scale schema sense serverside service skill skills solution solving source stack startup storage strong supervision support system task team technology template temporarily third threading tight tool toolkit total trend type understand urgency use userface various verbal version web websockets work working workproject write year zeal
Billing cum Logistics Manager.docx,"Billing cum Logistics Manager

Job Summary
Urgent requirement of Billing cum Logistics Manager for Ecommerce Company
Locatio - Gurgaon
Company profile : detel-india.com
Responsibilities and Duties
Total Billing Monitor & Controlling
Invoice validation before sending to Customer with Accuracy
E-Commerce Billing, Monthly Fixed and Variable Billing.
Follow up & Clearance from Operation for specific Remarks in PODs (Shortages/Damages Etc)
Deductions booking off
Proper Documentation (Invoices/PODs Etc)
Reconciliation:
POD Reconciliation (Damages/Shortages/Other Remarks) & Resolution
Deductions Reconciliation & Recovery Preparation
Pending POD Controlling & Monitor",billing cum Logistics Manager Job Summary Urgent requirement Billing cum Logistics Manager Ecommerce Company Locatio Gurgaon Company profile detelindiacom Responsibilities Duties Total Billing monitor controlling Invoice validation send Customer Accuracy ECommerce Billing Monthly fix Variable Billing Follow Clearance Operation specific remark pod ShortagesDamages Etc deduction book proper Documentation invoicespods etc reconciliation pod Reconciliation damagesshortagesother Remarks Resolution Deductions Reconciliation Recovery Preparation pende pod Controlling monitor,Preparation requirement Gurgaon Duties Recovery billing Accuracy Etc detelindiacom pende reconciliation pod send Remarks Variable Operation book Responsibilities remark Follow Total cum ECommerce Job ShortagesDamages Controlling Urgent Manager Monthly Customer damagesshortagesother Reconciliation Ecommerce Billing Logistics profile Deductions validation fix controlling Summary etc Company Clearance specific deduction proper invoicespods Locatio Documentation Resolution Invoice monitor,Preparation requirement Gurgaon Recovery billing Accuracy Etc reconciliation pod Remarks Variable Operation book Follow Total cum ECommerce Job Urgent Manager Monthly Customer damagesshortagesother Reconciliation Ecommerce Billing Logistics profile validation fix Summary etc Company Clearance deduction Locatio Documentation Resolution Invoice,accuracy billing book clearance company controlling cum customer damagesshortagesother deduction deductions detelindiacom documentation duties ecommerce etc fix follow gurgaon invoice invoicespods job locatio logistics manager monitor monthly operation pende pod preparation profile proper reconciliation recovery remark remarks requirement resolution responsibilities send shortagesdamages specific summary total urgent validation variable
Data Scientist.docx,"Data Scientist/ ML Engineer

Game Change Solutions

-

Gurgaon, Haryana

Temporarily remote

20,00,000 - 25,00,000 a year

We are looking for a data scientist that will help us discover the information hidden in vast amounts of data and help us make smarter decisions to deliver even better products. Your primary focus will be in applying data mining techniques, doing statistical analysis, and building high quality prediction systems integrated with our products. Data Scientist at GameChange must be an energetic self-starter who can quickly grasp the companys vision, develop specific tactical plans, and begin implementation upon appropriate approvals. The candidate must be resourceful and able to deliver on a plan defined.

Responsibilities 

Data Crunching and data massaging on structured and unstructured data including Numerical, Text,

Audio and Video data

Implementation/fine-tuning of machine learning algorithms

Conducting Data science/machine learning experiments and presenting insights

Building innovative data products using cutting edge tools and technologies

Conduct data analysis independently or with limited supervision to generate business insights

Conduct diagnostic on the data to identify the improvement opportunities, design data-backed

performance improvement strategy, liaise with internal teams

Record keeping and data warehousing to enable Advanced Analytics operations for generating

meaningful business insights

Develop high quality client deliverables such as R models, Python scripts etc.

Skills required -

Excellent understanding of machine learning techniques and algorithms, such as k-NN, Naive Bayes,

SVM, Decision Forests, CNN, RNN, LSTM etc.

Experience with common data science toolkits, such as R, Weka, NumPy, OpenCV, MatLab, etc.

Great communication skills

Experience with data visualisation tools, such as D3.js, GGplot, etc.

Proficiency in using query languages such as SQL, Hive, Pig

Experience with NoSQL databases, such as MongoDB, Cassandra, HBase

Good applied statistics skills, such as distributions, statistical testing, regression, etc.

Good scripting and programming skills

Job Type: Full-time

Salary: 2,000,000.00 - 2,500,000.00 per year

Experience:

Data Science: 2 years (Preferred)

work: 1 year (Preferred)

Education:

Bachelor's (Preferred)",Data Scientist ML Engineer Game Change Solutions Gurgaon Haryana temporarily remote year look data scientist help discover information hide vast amount datum help make smart decision deliver even well product primary focus apply datum mining technique statistical analysis build high quality prediction system integrate product Data Scientist GameChange energetic selfstarter quickly grasp company vision develop specific tactical plan begin implementation appropriate approval candidate resourceful able deliver plan define Responsibilities Data Crunching datum massage structure unstructured datum include Numerical Text Audio video data implementationfinetune machine learn algorithm conduct Data sciencemachine learn experiment present insight build innovative data product use cut edge tool technology Conduct datum analysis independently limit supervision generate business insight conduct diagnostic datum identify improvement opportunity design databacke performance improvement strategy liaise internal team record keep datum warehousing enable Advanced Analytics operation generate meaningful business insight develop high quality client deliverable r model Python script skill require excellent understanding machine learn technique algorithm kNN Naive Bayes SVM decision forest CNN RNN lstm experience common datum science toolkit R Weka NumPy opencv MatLab great communication skill experience datum visualisation tool D3js GGplot Proficiency use query language SQL Hive Pig Experience NoSQL database MongoDB Cassandra HBase Good apply statistic skill distribution statistical testing regression good scripting programming skill Job Type Fulltime Salary year Experience Data Science year preferred work year Preferred Education Bachelors Preferred,Salary Gurgaon resourceful generate structure Naive year quality statistic enable machine implementation Scientist identify Job lstm Engineer use Good Bayes Text Experience scripting require science liaise smart analysis develop Bachelors look plan prediction vast specific Crunching Hive work preferred include decision tool script appropriate database product apply internal model build datum mining massage regression R Responsibilities visualisation diagnostic technology implementationfinetune Python SQL communication unstructured programming toolkit Weka quickly vision performance forest Type Haryana deliverable distribution GameChange limit approval ML warehousing integrate Data Proficiency discover company common present independently Conduct business Advanced Cassandra excellent kNN SVM system cut MongoDB skill r keep Solutions Analytics language Preferred Numerical define focus tactical databacke experience energetic Change client query able opencv Audio NumPy candidate Education operation learn help design record Pig grasp good primary testing even hide conduct innovative RNN improvement great strategy scientist well make D3js remote algorithm information selfstarter begin video opportunity supervision high edge insight MatLab experiment statistical NoSQL HBase technique Game deliver CNN Fulltime amount meaningful team GGplot understanding data sciencemachine Science temporarily,Salary Gurgaon generate structure year quality statistic enable machine implementation Scientist Job lstm Engineer Bayes Text Experience scripting science liaise analysis plan prediction Crunching Hive work decision tool script database product model datum mining massage regression R technology Python SQL communication programming toolkit Weka vision performance forest Type Haryana distribution GameChange limit approval ML warehousing Data Proficiency company present Conduct business Advanced Cassandra SVM system skill r language Preferred Numerical define databacke experience Change client query opencv Audio NumPy candidate Education operation help design record Pig grasp testing RNN improvement strategy scientist D3js algorithm information selfstarter video opportunity supervision edge insight MatLab experiment NoSQL HBase technique Game CNN Fulltime amount team GGplot data sciencemachine Science,able advanced algorithm amount analysis analytics apply appropriate approval audio bachelors bayes begin build business candidate cassandra change client cnn common communication company conduct crunching cut d3js data databacke database datum decision define deliver deliverable design develop diagnostic discover distribution edge education enable energetic engineer even excellent experience experiment focus forest fulltime game gamechange generate ggplot good grasp great gurgaon haryana hbase help hide high hive identify implementation implementationfinetune improvement include independently information innovative insight integrate internal job keep knn language learn liaise limit look lstm machine make massage matlab meaningful mining ml model mongodb naive nosql numerical numpy opencv operation opportunity performance pig plan prediction preferred present primary product proficiency programming python quality query quickly record regression remote require resourceful responsibilities rnn salary science sciencemachine scientist script scripting selfstarter skill smart solutions specific sql statistic statistical strategy structure supervision svm system tactical team technique technology temporarily testing text tool toolkit type understanding unstructured use vast video vision visualisation warehousing weka well work year
