Name,Context,Cleaned,Selective,Selective_Reduced,TF_Based
Primary English Teacher.docx,"Primary English Teacher

Position Title: Facilitator for fREADom Live Classes
Department: fREADom Mobile App
Working with: Consumer App Team
Location: comfort of your own home!

About Stones2Milestones
Stones2Milestones is on a mission to 'Create a Nation of Readers', gifting children the will and skill to read in English. We have created Indias most premier reading program for children of ages 3-9 and are currently impacting over 200,000 children in 110 schools across 50+ cities.
A significant part of this reading program is the fREADom mobile app. The award-winning app, which parents and children use at home to bond over reading, has over 1500 stories, activities and news pieces for children to read and enjoy.
The team believes that by helping children to 'Learn to Read' in elementary years, they enable them to 'Read to Learn' during formal education and eventually 'Read to Lead' in their chosen paths, helping them find their place in the world. Today, we are leveraging our technology platforms to grow our mission across three axes- age, geography and stakeholders.
Position, Purpose and Key Responsibilities:
We are looking to bring into our fold an incredible teacher/facilitator to conduct online classes for children of ages 6-10. These classes will be on topics related to phonics, vocabulary, comprehension, conversational English, storytelling and writing. They will be conducted via a video calling technology interface. Each class will be 45-60 minutes long. All the material you need to conduct the class will be provided.
This is a monthly retainership role. You will not be a full time employee of the company unless offered otherwise. The classes will happen between 3 pm - 8 pm.
Key Responsibilities:

Conducting excellent and engaging live classes for children:

Conducting a minimum of 12 classes a week and maximum of 20 classes in a week in a way that children are able to meet their learning outcomes.

Improving constantly:

Working relentlessly to improve the childrens class experience and own knowledge of facilitation, pedagogy and technology. Accept feedback and give the Stones2Milestones team constructive feedback on the classes, topic flow and resources as well.

Adhering to administrative needs for all classes:

Ensuring marking of attendance, correction of childrens homework and keeping all documentation up to date.
Necessary prerequisites - skills

Excellent communicative and written English

Teaching experience (online or in a classroom)

Ease of using or ability to learn and grasp technology like email, Google Slides and Google Sheets

Necessary prerequisites - technology

Strong, fully functioning and hi-speed Internet connection

A good laptop or tablet, functioning webcam, good speaker

A good smartphone

Remuneration:
(A) Skills, abilities and attitudes:

Support of a great network of facilitators

Opportunities for pedagogical development

Ability to spend time with children who love and adore you, look forward to pleasing you

(b) Monetary:

2 classes/day - 11k/month

3 classes/day - 17k/month

Job Types: Full-time, Contract

Experience:

work: 1 year (Preferred)

total work: 1 year (Preferred)

Education:

Bachelor's (Preferred)",primary English Teacher Position Title Facilitator fREADom Live Classes Department fREADom Mobile App Working Consumer App Team Location comfort home Stones2Milestones Stones2Milestones mission Create Nation reader gift child skill read English create Indias premier read program child age currently impact child school city significant part read program fREADom mobile app awardwinne app parent child use home bond reading story activitie news piece child read enjoy team believe help child Learn Read elementary year enable Read learn formal education eventually Read Lead choose path find place world today leverage technology platform grow mission axis age geography stakeholder Position Purpose Key Responsibilities look bring fold incredible teacherfacilitator conduct online class child age class topic relate phonic vocabulary comprehension conversational english storytelling writing conduct video calling technology interface class minute long material need conduct class provide monthly retainership role full time employee company offer otherwise class happen pm pm Key Responsibilities conduct excellent engage live class child conduct minimum class week maximum class week way child able meet learn outcome improve constantly work relentlessly improve children class experience knowledge facilitation pedagogy technology accept feedback give Stones2Milestones team constructive feedback class topic flow resource well adhere administrative need class ensure mark attendance correction children homework keep documentation date Necessary prerequisite skill excellent communicative write English Teaching experience online classroom ease use ability learn grasp technology email Google Slides Google Sheets Necessary prerequisite technology strong fully function hispeed internet connection good laptop tablet functioning webcam good speaker good smartphone Remuneration A Skills abilitie attitude Support great network facilitator Opportunities pedagogical development ability spend time child love adore look forward please b monetary classesday 11kmonth classesday 17kmonth Job Types Fulltime Contract experience work year preferred total work year Preferred Education Bachelors Preferred,ensure Support premier Department year happen Teacher read smartphone enable tablet find place parent significant function give news facilitator Team flow documentation week forward Job use eventually comprehension Live knowledge class pm connection Bachelors Working look Location full functioning abilitie constantly work preferred conversational phonic material Key employee please city role classesday long facilitation accept Necessary school geography age mission calling date speaker hispeed Opportunities offer adhere reader Responsibilities part technology mobile axis english outcome Teaching fold 17kmonth path storytelling administrative leverage otherwise live pedagogical b piece believe ability Title homework spend incredible child company prerequisite mark attendance Slides 11kmonth topic pedagogy excellent stakeholder communicative grow improve bond development skill attitude Classes gift keep Preferred Remuneration Position fully online vocabulary Consumer meet experience network resource Mobile feedback fREADom able correction currently home today provide engage retainership Education learn help Learn grasp comfort good English primary bring love Read Types write conduct classroom Facilitator great enjoy constructive Create need Purpose well create adore minimum Contract total ease relentlessly impact choose writing laptop video Google interface app world teacherfacilitator time monthly children education internet elementary minute relate program Skills platform Lead Sheets Nation A App formal monetary email Fulltime maximum reading Indias webcam team Stones2Milestones story activitie strong awardwinne way,Support premier Department year Teacher tablet find place parent function news facilitator Team flow documentation week Job use comprehension knowledge class pm connection Bachelors Working Location abilitie phonic material employee city role classesday facilitation school geography age mission date speaker reader Responsibilities part technology axis english outcome path leverage b piece believe ability Title homework child company prerequisite mark attendance 11kmonth topic pedagogy stakeholder bond development skill attitude gift Preferred Remuneration Position vocabulary Consumer experience network resource Mobile feedback fREADom correction today engage retainership Education help grasp comfort primary love Read conduct classroom Facilitator Create need Purpose adore Contract total ease impact laptop video Google interface app world teacherfacilitator time education internet minute relate program platform Lead Sheets Nation App email Fulltime Indias webcam team Stones2Milestones story awardwinne way,11kmonth 17kmonth abilitie ability able accept activitie adhere administrative adore age app attendance attitude awardwinne axis bachelors believe bond bring calling child children choose city class classes classesday classroom comfort communicative company comprehension conduct connection constantly constructive consumer contract conversational correction create currently date department development documentation ease education elementary email employee enable engage english enjoy ensure eventually excellent experience facilitation facilitator feedback find flow fold formal forward freadom full fulltime fully function functioning geography gift give good google grasp great grow happen help hispeed home homework impact improve incredible indias interface internet job keep key knowledge laptop lead learn leverage live location long look love mark material maximum meet minimum minute mission mobile monetary monthly nation necessary need network news offer online opportunities otherwise outcome parent part path pedagogical pedagogy phonic piece place platform please pm position preferred premier prerequisite primary program provide purpose read reader reading relate relentlessly remuneration resource responsibilities retainership role school sheets significant skill skills slides smartphone speaker spend stakeholder stones2milestones story storytelling strong support tablet teacher teacherfacilitator teaching team technology time title today topic total types use video vocabulary way webcam week well work working world write writing year
Revenue Reporting Data Analyst.docx,"Revenue Reporting Data Analyst, Business Finance Accounting



Minimum qualifications:



Bachelor's degree in Accounting, Finance, Business, Engineering or Data Science or equivalent practical experience.

4 years of relevant work experience.

Database experience including SQL coding across standard commercial databases or equivalent in other programming languages.

Experience with standard finance systems (e.g. Oracle, Hyperion, OBIEE, SAP) and core finance processes.

Preferred qualifications:



Experience driving operational process improvement.

Experience developing and analyzing large, complex data sets and converting them into information/insights that drive business decisions at all levels of the organization.

Ability to multi-task and apply initiative and creativity on challenging projects.

Distinctive problem-solving and analytical skills combined with strong business acumen.

Exemplary customer service and tactful communication skills, both spoken and written.

Exceptional analytical and technical problem solving skills.

About the job

Analysts on the Business Finance and Accounting Systems team collaborate with multiple teams to ensure that we have robust, scalable data and reporting processes to support our business partners to deliver on internal and external data requests.



As a Revenue Reporting Data Analyst, you will be focused on executing on internal and external data and reporting requests, including implementing opportunities to optimize our reporting data infrastructure. You will work well with other teams, provide outstanding customer service, deliver on deadlines, and produce flawless work. This role will partner with our Accounting Operations, Tax, External Reporting and Legal teams to provide timely data to manage financial risk, educate users on Googles revenue data sets and drive efficiency improvements, ensuring that partners can adhere to regulatory requirements. You will also work closely with these teams to develop scalable data solutions for accounting and reporting processes.



Responsibilities

Work with cross-functional departments on reporting data and system initiatives.

Utilize SQL coding to provide financial data for internal and external financial reporting.

Critically evaluate data gathered from multiple sources, identify gaps, reconcile conflicts and decompose high-level information into details to drive decision-making.

Partner with internal teams to define and implement data solutions that improve accounting and reporting processes and architect innovative data solutions to automate and scale revenue reporting.

Maintain highest levels of development practices including technical design, solution development, systems configuration, test documentation/execution, issue identification and resolution, and writing clean, modular and self-sustaining code.",Revenue Reporting Data Analyst Business Finance Accounting Minimum qualification Bachelors degree Accounting Finance Business Engineering Data Science equivalent practical experience year relevant work experience database experience include SQL code standard commercial database equivalent programming language experience standard finance system eg Oracle Hyperion OBIEE SAP core finance process preferred qualification experience drive operational process improvement experience develop analyze large complex datum set convert informationinsight drive business decision level organization ability multitask apply initiative creativity challenge project distinctive problemsolve analytical skill combine strong business acumen exemplary customer service tactful communication skill write exceptional analytical technical problem solve skill job Analysts Business Finance Accounting Systems team collaborate multiple team ensure robust scalable datum reporting process support business partner deliver internal external datum request Revenue Reporting Data Analyst focus execute internal external datum report request include implement opportunity optimize report data infrastructure work well team provide outstanding customer service deliver deadline produce flawless work role partner Accounting Operations Tax External Reporting legal team provide timely datum manage financial risk educate user Googles revenue datum set drive efficiency improvement ensure partner adhere regulatory requirement also work closely team develop scalable data solution account reporting process Responsibilities Work crossfunctional department report datum system initiative Utilize SQL coding provide financial datum internal external financial reporting critically evaluate datum gather multiple source identify gap reconcile conflict decompose highlevel information detail drive decisionmake Partner internal team define implement data solution improve accounting reporting process architect innovative datum solution automate scale revenue reporting maintain high level development practice include technical design solution development system configuration test documentationexecution issue identification resolution write clean modular selfsustaining code,exemplary issue initiative ensure organization problemsolve Business SAP legal efficiency year crossfunctional request reconcile complex degree scale identify Revenue OBIEE qualification set decisionmake problem practice develop Bachelors configuration source evaluate level work preferred gather include decision exceptional risk Analyst manage role requirement database apply internal multitask user datum produce standard Hyperion adhere Responsibilities critically SQL communication deadline programming distinctive Engineering collaborate Accounting challenge architect tactful Operations core ability revenue code Data external equivalent account Partner Googles practical multiple department scalable business implement report Oracle analyze regulatory system improve infrastructure development skill resolution closely service language automate financial gap Work detail technical conflict define experience focus creativity job Systems accounting Minimum External optimize highlevel analytical Tax robust large provide also timely design modular eg finance Analysts test solve reporting write commercial outstanding execute educate innovative documentationexecution improvement Utilize clean well project partner Reporting information Finance selfsustaining process opportunity decompose high maintain informationinsight flawless operational deliver customer acumen convert identification team relevant drive data solution Science support combine strong coding,issue initiative organization problemsolve Business SAP efficiency year request degree scale Revenue OBIEE qualification decisionmake problem practice Bachelors configuration source level work gather decision risk Analyst manage role requirement database multitask user datum Hyperion adhere SQL communication deadline programming Engineering collaborate Accounting challenge architect core ability revenue code Data account Partner Googles department business implement report Oracle analyze system infrastructure development skill resolution language gap Work detail conflict define experience focus creativity job Minimum optimize highlevel Tax design eg finance test execute documentationexecution improvement Utilize project partner Reporting information Finance selfsustaining process opportunity customer acumen convert identification team drive solution Science support coding,ability account accounting acumen adhere also analyst analysts analytical analyze apply architect automate bachelors business challenge clean closely code coding collaborate combine commercial communication complex configuration conflict convert core creativity critically crossfunctional customer data database datum deadline decision decisionmake decompose define degree deliver department design detail develop development distinctive documentationexecution drive educate efficiency eg engineering ensure equivalent evaluate exceptional execute exemplary experience external finance financial flawless focus gap gather googles high highlevel hyperion identification identify implement improve improvement include information informationinsight infrastructure initiative innovative internal issue job language large legal level maintain manage minimum modular multiple multitask obiee operational operations opportunity optimize oracle organization outstanding partner practical practice preferred problem problemsolve process produce programming project provide qualification reconcile regulatory relevant report reporting request requirement resolution responsibilities revenue risk robust role sap scalable scale science selfsustaining service set skill solution solve source sql standard strong support system systems tactful tax team technical test timely user utilize well work write year
