Name,Context,Cleaned,Selective,Selective_Reduced,TF_Based
IT Project Manager.docx,"IT Project Manager

Roles and Responsibilities

Accomplishes information technology staff results by communicating job expectations; planning, monitoring, and appraising job results; coaching, counseling, and disciplining employees; initiating, coordinating, and enforcing systems, policies, and procedures.

Maintains staff by recruiting, selecting, orienting, and training employees; maintaining a safe and secure work environment; developing personal growth opportunities.

Maintains organization's effectiveness and efficiency by defining, delivering, and supporting strategic plans for implementing information technologies.

Directs technological research by studying organization goals, strategies, practices, and user projects.

Completes projects by coordinating resources and timetables with user departments and data center.

Verifies application results by conducting system audits of technologies implemented.

Preserves assets by implementing disaster recovery and back-up procedures and information security and control structures.

Recommends information technology strategies, policies, and procedures by evaluating organization outcomes; identifying problems; evaluating trends; anticipating requirements.

Accomplishes financial objectives by forecasting requirements; preparing an annual budget; scheduling expenditures; analyzing variances; initiating corrective action.

Maintains quality service by establishing and enforcing organization standards.

Maintains professional and technical knowledge by attending educational workshops; reviewing professional publications; establishing personal networks; benchmarking state-of-the-art practices; participating in professional societies.

Contributes to team effort by accomplishing related results as needed.

Desired Candidate Profile

Qualification:

B.e/B.tech/MCA/Msc/M.e-IT/Computer science

Experience: Minimum 1 year as project manager",IT Project Manager Roles Responsibilities accomplish information technology staff result communicate job expectation plan monitoring appraise job result coach counseling discipline employee initiate coordinate enforce system policy procedure Maintains staff recruit select orient training employee maintain safe secure work environment develop personal growth opportunity maintain organization effectiveness efficiency define deliver support strategic plan implement information technology direct technological research study organization goal strategy practice user project Completes project coordinate resource timetable user department datum center Verifies application result conduct system audits technology implement Preserves asset implement disaster recovery backup procedure information security control structure recommend information technology strategy policie procedure evaluate organization outcome identify problem evaluate trend anticipate requirement accomplish financial objective forecasting requirement prepare annual budget scheduling expenditure analyze variance initiate corrective action Maintains quality service establish enforce organization standard maintain professional technical knowledge attend educational workshop review professional publication establish personal network benchmarke stateoftheart practice participate professional society Contributes team effort accomplish relate result need desire Candidate Profile Qualification bebtechmcamscmeitcomputer science Experience Minimum year project manager,center organization direct Project anticipate corrective structure efficiency objective policie year quality participate review procedure identify knowledge disaster Experience science problem establish safe practice develop staff Completes plan evaluate work monitoring IT environment employee requirement personal user datum strategic standard study Responsibilities coach research technology outcome security budget communicate scheduling technological coordinate backup recovery recommend expectation counseling expenditure recruit professional department forecasting implement bebtechmcamscmeitcomputer Roles Candidate analyze training goal system select Preserves initiate audits service financial trend technical effectiveness define Manager network Qualification job resource discipline Profile policy effort growth action accomplish desire stateoftheart result society control conduct workshop orient manager enforce educational appraise strategy annual need Verifies project application Contributes information attend asset opportunity maintain secure prepare relate Maintains variance benchmarke deliver team timetable publication support Minimum,center organization Project structure efficiency objective policie year quality participate review procedure knowledge disaster Experience science problem practice staff plan work IT environment employee requirement user datum study Responsibilities coach research technology outcome security budget communicate coordinate recovery recommend expectation counseling expenditure department forecasting bebtechmcamscmeitcomputer Roles Candidate analyze training goal system Preserves audits service trend effectiveness Manager network Qualification job resource discipline Profile policy effort growth action desire stateoftheart result society control workshop orient manager appraise strategy Verifies project application information asset opportunity prepare relate Maintains variance benchmarke team timetable publication support,accomplish action analyze annual anticipate application appraise asset attend audits backup bebtechmcamscmeitcomputer benchmarke budget candidate center coach communicate completes conduct contributes control coordinate corrective counseling datum define deliver department desire develop direct disaster discipline educational effectiveness efficiency effort employee enforce environment establish evaluate expectation expenditure experience financial forecasting goal growth identify implement information initiate it job knowledge maintain maintains manager minimum monitoring need network objective opportunity organization orient outcome participate personal plan policie policy practice prepare preserves problem procedure professional profile project publication qualification quality recommend recovery recruit relate requirement research resource responsibilities result review roles safe scheduling science secure security select service society staff standard stateoftheart strategic strategy structure study support system team technical technological technology timetable training trend user variance verifies work workshop year
Lead Technical Program Manager.docx,"Lead Technical Program Manager, Site Reliability Engineering

Minimum qualifications:



Bachelor's degree in Computer Science, a related technical field or equivalent practical experience.

Experience managing end-to-end lifecycle of technical projects.

Experience with Unix/Linux systems with scripting experience in Shell, Perl or Python.

Experience in one or more of the following: C, C++, Java, Python.

Preferred qualifications:



Program management or technical management experience leading large-scale, cross-functional, and dynamic technical projects.

Software engineering management or project management expertise.

Ability to define strategic goals and organize a team and their services around delivering on those goals.

Leadership skills and a passion for growing and building an effective TPM function within an SRE organization.

Excellent communication skills, with ability to articulate your thoughts clearly and communicate across a wide variety of functions (SRE, Engineering) and levels.

About the job

Google's projects, like our users, span the globe and require managers to keep the big picture in focus while being able to dive into the unique engineering challenges we face daily. As a Technical Program Manager at Google, you lead complex, multi-disciplinary engineering projects using your engineering expertise. You plan requirements with internal customers and usher projects through the entire project lifecycle. This includes managing project schedules, identifying risks and clearly communicating them to project stakeholders. You're equally at home explaining your team's analyses and recommendations to executives as you are discussing the technical trade-offs in product development with engineers.



In this role you will manage a group of Technical Program Managers (TPMs) working across a multitude of product groups who manage complex programs. The TPM role in SRE is at the core of preparing for the continued exponential growth of Google and other programs in Technical Infrastructure. TPMs play a pivotal role in ensuring that Google services/infrastructure are carefully planned and deployed in a time, place, and configuration which is ideal for serving Google's users. Your role sits at a nexus of capacity planning, technical project execution, product planning, site reliability and software engineering.



Your leadership abilities will be drawn upon to assist the TPM function in delivering large, highly complex and cross-functional programs. You will be equally at home explaining analyses and project recommendations to executives as you are discussing the technical merits of next-generation architectures with engineers, or building tools to automate and scale their impact.



Behind everything our users see online is the architecture built by the Technical Infrastructure team to keep it running. From developing and maintaining our data centers to building the next generation of Google platforms, we make Google's product portfolio possible. We're proud to be our engineers' engineers and love voiding warranties by taking things apart so we can rebuild them. We keep our networks up and running, ensuring our users have the best and fastest experience possible.



Responsibilities

Manage a team of TPMs working across all core networking groups and assist where necessary to ensure successful delivery of multiple programs concurrently. 

Assist Director on operational management of Product Area.

Collaborate with SRE leadership in key program decision making - including scope definition, requirements gathering, staffing, planning and execution of programs. 

Work with cross-functional partners and manage the intake of work into teams in a process and scalable driven fashion. 

Be responsible for the people and career development of TPMs and working to identify opportunities for exciting career challenges. Ensure there is flexibility and mobility opportunities also.",Lead Technical Program Manager Site Reliability Engineering Minimum qualification Bachelors degree Computer Science relate technical field equivalent practical experience experience managing endtoend lifecycle technical project Experience UnixLinux system scripting experience Shell Perl Python experience follow c c Java Python Preferred qualification Program management technical management experience lead largescale crossfunctional dynamic technical project Software engineering management project management expertise ability define strategic goal organize team service deliver goal leadership skill passion grow building effective TPM function SRE organization excellent communication skill ability articulate thought clearly communicate wide variety function SRE Engineering level job Googles project user span globe require manager keep big picture focus able dive unique engineering challenge face daily Technical Program Manager Google lead complex multidisciplinary engineering project use engineering expertise plan requirement internal customer usher project entire project lifecycle include manage project schedule identify risk clearly communicate project stakeholder re equally home explain team analyse recommendation executive discuss technical tradeoffs product development engineer role manage group Technical Program manager tpm work multitude product group manage complex program TPM role sre core prepare continue exponential growth Google program Technical Infrastructure tpm play pivotal role ensure Google servicesinfrastructure carefully plan deploy time place configuration ideal serve Googles user role sit nexus capacity plan technical project execution product planning site reliability software engineering leadership ability draw assist TPM function deliver large highly complex crossfunctional program equally home explain analyse project recommendation executive discuss technical merit nextgeneration architecture engineer building tool automate scale impact user see online architecture build Technical Infrastructure team keep run develop maintain data center build next generation Google platform make Googles product portfolio possible be proud engineer engineer love void warranty take thing apart rebuild keep network run ensure user well fast experience possible responsibility manage team tpm work core networking group assist necessary ensure successful delivery multiple program concurrently Assist Director operational management Product Area Collaborate SRE leadership key program decision making include scope definition requirement gather staffing planning execution program work crossfunctional partner manage intake work team process scalable drive fashion be responsible people career development tpm work identify opportunity exciting career challenge Ensure flexibility mobility opportunity also,passion UnixLinux pivotal Product clearly ensure center organization Computer engineer Ensure portfolio recommendation architecture crossfunctional tpm engineering rebuild place globe complex degree function scale identify execution nexus use ideal qualification scripting Experience picture require Assist SRE discuss develop Bachelors configuration plan executive possible generation people level work Director key gather include decision group tool risk equally manage role requirement product Java internal take Reliability span user build Software deploy fashion fast strategic schedule articulate Python field communication follow daily software merit Engineering communicate successful challenge apart c dive lifecycle core draw warranty continue ability organize Technical equivalent career dynamic building see Googles practical face making lead scope multiple definition scalable Shell excellent stakeholder concurrently Site carefully goal system grow re necessary sit development skill exciting Perl networking leadership keep service automate Preferred planning technical define proud experience Manager focus online job network Collaborate servicesinfrastructure endtoend staffing next delivery variety able expertise responsibility growth capacity wide mobility home large managing also multidisciplinary big site love analyse reliability assist usher sre Program manager flexibility run explain largescale well play entire project multitude make thing impact partner Infrastructure Google process opportunity nextgeneration TPM time unique exponential maintain highly be prepare relate program serve platform Lead operational Area void deliver effective customer tradeoffs intake team data drive management thought Science responsible Minimum,passion UnixLinux Product center organization Computer engineer Ensure portfolio recommendation architecture engineering place globe degree function scale execution nexus use qualification scripting Experience picture Assist SRE Bachelors configuration plan executive generation level work Director gather decision group tool risk role requirement product Java Reliability span user build Software fashion schedule Python field communication software merit Engineering challenge c dive lifecycle core draw warranty ability career building Googles face lead scope definition Shell stakeholder Site goal system development skill Perl networking leadership service automate planning experience Manager job network servicesinfrastructure delivery variety expertise responsibility growth capacity mobility home site love analyse reliability sre Program manager flexibility largescale project multitude thing impact partner Infrastructure Google process opportunity nextgeneration TPM time exponential prepare relate program serve platform Lead Area customer team drive management Science Minimum,ability able also analyse apart architecture area articulate assist automate bachelors be big build building capacity career carefully center challenge clearly collaborate communicate communication complex computer concurrently configuration continue core crossfunctional customer daily data decision define definition degree deliver delivery deploy develop development director discuss dive draw drive dynamic effective endtoend engineer engineering ensure entire equally equivalent excellent exciting execution executive experience expertise explain exponential face fashion fast field flexibility focus follow function gather generation globe goal google googles group grow growth highly home ideal identify impact include infrastructure intake internal java job keep key large largescale lead leadership level lifecycle love maintain make making manage management manager managing merit minimum mobility multidisciplinary multiple multitude necessary network networking next nextgeneration nexus online operational opportunity organization organize partner passion people perl picture pivotal place plan planning platform play portfolio possible practical preferred prepare process product program project proud python qualification re rebuild recommendation relate reliability require requirement responsibility responsible risk role run scalable scale schedule science scope scripting see serve service servicesinfrastructure shell sit site skill software span sre staffing stakeholder strategic successful system take team technical thing thought time tool tpm tradeoffs unique unixlinux use user usher variety void warranty well wide work
